id,title,author,publisher,pubplace,keywords,date
A46228,"The divell is an asse a comedie acted in the yeare 1616, by His Majesties servants / the author, Ben. Iohnson.","Jonson, Ben, 1573?-1637.",s n,Imprinted at London,No Keywords,1641
A06343,"Phylaster, or, Loue lyes a bleeding acted at the Globe by His Maiesties seruants / written by [brace] Francis Baymont and Iohn Fletcher ...","Fletcher, John, 1579-1625.; Beaumont, Francis, 1584-1616.",For Thomas Walkley and are to be sold at his shop at the Eagle and Child in Brittaines Bursse,Printed at London,No Keywords,1620
A03229,"Londini emporia, or Londons mercatura Exprest in sundry triumphs, pageants and showes, at the inauguration of the Right Honorable Ralph Freeman into the Maiorty of the famous and farre renowned citty London. All the charge and expence of the laborious proiects, both by water and land, being the sole vndertaking of the Right Worshipfull Company of the Cloath-Workers, written by Thomas Heyvvood.","Heywood, Thomas, d. 1641.",By Nicholas Okes,Printed at London,"Freeman, Ralph, d. 1634.",1633
A03405,"Histrio-mastix· Or, The player vvhipt","Marston, John, 1575?-1634.",Printed by George Eld for Th Thorp,London,No Keywords,1610
A02132,"A maidens dreame vpon the death of the Right Honorable Sir Christopher Hatton knight, late Lord Chancelor of England / by Robert Green ...","Greene, Robert, 1558?-1592.",By Thomas Scarlet for Thomas Nelson,Imprinted at London,"Hatton, Christopher, --  Sir, 1540-1591 --  Poetry.",1591
A02151,"The pleasant historie of Dorastus and Fawnia VVherein is discovered, that although by the meanes of sinister fortune, truth may be concealed; yet by time, in spight of fortune, it is manifestly revealed. ... By Robert Greene, Master of Arts in Cambridge.","Greene, Robert, 1558?-1592.",Printed by Elizabeth Purslowe for Francis Faulkner and are to be sold at his shop in Southwarke neere Saint Margarets Hill,London,No Keywords,1636
A02120,"Greenes Orpharion VVherin is discouered a musicall concorde of pleasant histories, many sweet moodes graced vvith such harmonius discords, as agreeing in a delightfull closse, they sound both pleasure and profit to the eare. Heerein also as in a diateheron, the branches of vertue, ascending and descending by degrees: are covnited in the glorious praise of women-kind. VVith diuers tragicall and comicall histories presented by Orpheus and Arion, beeing as full of profit as of pleasure. Robertus Greene, in Artibus Magister.","Greene, Robert, 1558?-1592.",Printed by J Roberts for Edward VVhite dwelling at the little north doore of S Paules Church at the signe of the Gun,At London,No Keywords,1599
A02143,"Pandosto the triumph of time. VVherein is discouered by a pleasant historie, that although by the meanes of sinister fortune truth may be concealed, yet by time in spight of fortune it is most manifestlie reuealed. Pleasant for age to auoyde drowsie thoughtes, profitable for youth to eschue other wanton pastimes, and bringing to both a desired content. Temporis filia veritas. By Robert Greene Maister of Artes in Cambridge.","Greene, Robert, 1558?-1592.",By Thomas Orwin for Thomas Cadman dwelling at the signe of the Bible neere vnto the north doore of Paules,Imprinted at London,"Shakespeare, William, 1564-1616. --  Winter's Tale --  Sources --  Early works to 1800.",1588
A03192,A curtaine lecture as it is read by a countrey farmers wife to her good man. By a countrey gentlewoman or lady to her esquire or knight. By a souldiers wife to her captain or lievtenant. By a citizens or tradesmans wife to her husband. By a court lady to her lord. Concluding with an imitable lecture read by a queene to her soveraigne lord and king.,"Heywood, Thomas, d. 1641.",Printed by Robert Young for Iohn Aston,London,Marriage --  Early works to 1800.,1637
A03258,"The late Lancashire vvitches A well received comedy, lately acted at the Globe on the Banke-side, by the Kings Majesties Actors. Written, by Thom. Heyvvood, and Richard Broome.","Heywood, Thomas, d. 1641.; Brome, Richard, d. 1652? aut",Printed by Thomas Harper for Benjamin Fisher and are to be sold at his shop at the signe of the Talbot without Aldersgate,London,No Keywords,1634
A02079,"The blacke bookes messenger Laying open the life and death of Ned Browne one of the most notable cutpurses, crosbiters, and conny-catchers, that euer liued in England. Heerein hee telleth verie pleasantly in his owne person such strange prancks and monstrous villanies by him and his consorte performed, as the like was yet neuer heard of in any of the former bookes of conny-catching. By R.G.","Greene, Robert, 1558?-1592.",By Iohn Danter for Thomas Nelson dwelling in Siluer streete neere to the signe of the Red Crosse,Printed at London,"Browne, Ned --  Early works to 1800. -- Crime --  England --  London --  Early works to 1800. -- Criminals --  England --  London --  Early works to 1800. -- London (England) --  Social life and customs --  Early works to 1800.",1592
A07083,The vvonder of vvomen or The tragedie of Sophonisba as it hath beene sundry times acted at the Blacke Friers. Written by Iohn Marston.,"Marston, John, 1575?-1634.",Printed by Iohn Windet and are to be sold by W Cotton neere Ludgate,London,No Keywords,1606
A06703,Micro-cynicon. Sixe snarling satyres Insatiat Cron. Prodigall Zodon. Insolent Superbia. Cheating Droone. Ingling Pyander. Wise Innocent.,"Middleton, Thomas, d. 1627, attributed name.",By Thomas Creede for Thomas Bushell and are to be sold at his shop at the north doore of Paules Church,Imprinted at London,No Keywords,1599
A07518,"The triumphs of truth A solemnity vnparalleled for cost, art, and magnificence, at the confirmation and establishment of that worthy and true nobly-minded gentleman, Sir Thomas Middleton, knight, in the honorable office of his Maiesties lieuetenant, the lord maior of the thrice famous citty of London. Taking beginning at his Lord-ships going, and proceeding after his returne from receiuing the oath of maioralty at Westminster, on the morrow next after Simon and Iudes day, October 29. 1613. All the showes, pageants, chariots; morning, noone, and night-triumphes. Directed, written, and redeem'd into forme, from the ignorance of some former times, and their common writer, by Thomas Middleton.","Middleton, Thomas, d. 1627.",Printed by Nicholas Okes dwelling at the signe of the Hand neere Holbourne Bridge,London,"Middleton, Thomas, --  Sir, 1550-1631 --  Early works to 1800.",1613
A03201,"The fair maid of the vvest. Or, A girle worth gold. The first part. As it was lately acted before the King and Queen, with approved liking. By the Queens Majesties Comedians. Written by T.H.","Heywood, Thomas, d. 1641.",Printed by Miles Flesher for Richard Royston and are to be sold at his shop in Ivie Lane,London,No Keywords,1631
A02141,"The second part of conny-catching Contayning the discouery of certaine wondrous coosenages, either superficiallie past ouer, or vtterlie vntoucht in the first. ... R.G.","Greene, Robert, 1558?-1592. Notable discovery of coosenage.; Greene, Robert, 1558?-1592.",Printed by Iohn Wolfe for William Wright and are to be sold at his shop in Pauls Church yard neare to the French schoole,London,Crime --  England --  Early works to 1800. -- Criminals --  England --  Early works to 1800. -- London (England) --  Social life and customs --  16th century --  Early works to 1800.,1591
A03190,"A challenge for beautie· as it hath beene sundry times acted, by the Kings Majesties Servants: at the Blacke-friers, and at the Globe on the Banke-side. Written by Thomas Heywood.","Heywood, Thomas, d. 1641.",Printed by R Raworth and are to bee sold by Iames Becket at his shop in the Inner Temple Gate,London,No Keywords,1636
A03239,"Philocothonista, or, The drunkard, opened, dissected, and anatomized","Heywood, Thomas, d. 1641.",Printed by Robert Raworth and are to be sold at his house neere the White Hart Taverne in Smithfield,London,Alcoholics --  Early works to 1800.,1635
A02122,"Gvvydonius The carde of fancie wherein the folly of those carpet knights is decyphered, which guyding their course by the compasse of Cupid, either dash their ship against most daungerous rocks, or els attaine the hauen with paine and perill. Wherein also is described in the person of Gwydonius, a cruell combat betvveene nature and necessitie. By Robert Greene Master of Arte, in Cambridge.","Greene, Robert, 1558?-1592.; Labé, Louise, 1526?-1566. Debat de folie et d'amour.",Imprinted by T East for VVilliam Posonby,At London,No Keywords,1584
A03244,"The rape of Lucrece a true Roman tragedie. With the seuerall songes in their apt places, by Valerius, the merrie lord amongst the Roman peeres. Acted by her Majesties Seruants at the Red-Bull, neere Clarken-well. Written by Thomas Heywood.","Heywood, Thomas, d. 1641.",Printed by E Allde for I B usby and are to be solde by Nathaniel Butter in Paules Church yard at the signe of the Pide Bull,London,No Keywords,1608
A02053,Nevves from Graues-end sent to nobody.,"Dekker, Thomas, ca. 1572-1632.",Printed by T homas C reede for Thomas Archer and are to be solde at the long Shop vnder S Mildreds Church in the Poultry,London,Plague --  England --  Poetry --  Early works to 1800. -- Plague --  England --  Early works to 1800.,1604
A03235,"Loves maistresse: or, The Queens masque As it was three times presented before their two Excellent Maiesties, within the space of eight dayes; in the presence of sundry forraigne ambassadors. Publikely acted by the Queens Comœdians, at the Phœnix in Drury-Lane. Written by Thomas Heywood.","Heywood, Thomas, d. 1641.",Printed by Robert Raworth for Iohn Crowch and are to bee sold by Iasper Emery at the signe of the Eagle and Child in Pauls Church yard,London,No Keywords,1636
A02153,"Perimedes the blacke-smith a golden methode, how to vse the minde in pleasant and profitable exercise: wherein is contained speciall principles fit for the highest to imitate, and the meanest to put in practise, how best to spend the wearie winters nights, or the longest summers euenings, in honest and delightfull recreation: wherein we may learne to auoide idlenesse and wanton scurrilitie, vvhich diuers appoint as the end of their pastimes. Heerein are interlaced three merrie and necessarie discourses fit for our time: with certaine pleasant histories and tragicall tales, which may breed delight to all, and offence to none.","Greene, Robert, 1558?-1592.",Printed by Iohn VVolfe for Edward White,London,No Keywords,1588
A03248,"The royall king, and the loyall subject As it hath beene acted with great applause by the Queenes Maiesties Servants. Written by Thomas Heywood.","Heywood, Thomas, d. 1641.; Bandello, Matteo, 1485-1561. Novelle. Part 1. Novella 2.",Printed by Nich and Iohn Okes for Iames Becket and are to be sold at his shop at the inner Temple neare the Gate,London,No Keywords,1637
A03256,A woman kilde with kindnesse. Written by Tho. Heywood,"Heywood, Thomas, d. 1641.",Printed by William Iaggard dwelling in Barbican and are to be sold in Pauls Church yard by Iohn Hodges,London,No Keywords,1607
A03203,"A funerall elegie vpon the death of the late most hopefull and illustrious prince, Henry, Prince of Wales / vvritten by Thomas Heyvvood.","Heywood, Thomas, d. 1641.",Printed for William Welbie dwelling in Pauls Churchyard at the signe of the Swan,London,"Henry Frederick, --  Prince of Wales, 1594-1612 --  Poetry.",1613
A07504,"A mad vvorld, my masters As it hath bin lately in action by the Children of Paules. Composed by T.M.","Middleton, Thomas, d. 1627.",Printed by H enry B allard for Walter Burre and are to be sold in Paules Church yard at the signe of the Crane,London,No Keywords,1608
A06150,"The masque of the Inner Temple and Grayes Inne Grayes Inne and the Inner Temple, presented before his Maiestie, the Queenes Maiestie, the Prince, Count Palatine and the Lady Elizabeth their Highnesses, in the Banquetting house at White-hall on Saturday the twentieth day of Februarie, 1612.","Beaumont, Francis, 1584-1616.",Imprinted by F elix K ingston for George Norton and are to be sold at his shoppe neere Temple bar,At London,Masques --  Early works to 1800.,1613
A07081,VVhat you vvill. By Iohn Marston,"Marston, John, 1575?-1634.",By G Eld for Thomas Thorppe,Imprinted at London,No Keywords,1607
A02077,"The history of Arbasto King of Denmarke Describing the anatomy of fortune, his loue to faire Doralicia. Wherein gentlemen may finde pleasant conceits to purge melancholy, and perfect counsell to preuent mis-fortune. By Robert Green, Master of Art. Wherevnto is added a louely poem of Pyramus and Thisbe.","Greene, Robert, 1558?-1592.; Gale, Dunstan. Pyramus and Thisbe. aut",Printed by I B eale for Roger Iackson and are to be sold at his shop neere Fleet Conduit,London,No Keywords,1617
A07516,"The triumphs of integrity A noble solemnity, performed through the city, at the sole cost and charges of the Honorable Fraternity of Drapers, at the confirmation and establishment of their most worthy brother, the Right Honorable, Martin Lumley, in the high office of his Maiesties Lieutenant, Lord Maior and Chancellor of the famous City of London. Taking beginning at his Lordships going, and perfecting it selfe after his returne from receiuing the oath of maioralty at Westminster, on the morrow after Simon and Iudes Day, being the 29. of October. 1623. By Tho. Middleton Gent.","Middleton, Thomas, d. 1627.",Printed by Nicholas Okes dwelling in Foster lane,London,"[Lumley, Martin, --  Lord Mayor of London].",1623
A08517,Nevves sent to the Ladie Princesse of Orenge. Translated out of French into English by I.E.,"Eliot, John, attributed name.",Printed by Iohn VVolfe,London,"Lesdiguiéres, François de Bonne, --  duc de, 1543-1626 --  Early works to 1800. -- Louise de Coligny, --  Princess, consort of William I, Prince of Orange, 1555-1620 --  Early works to 1800. -- France --  History --  Wars of the Huguenots, 1562-1598 --  Sources.",1589
A04647,Euery man in his humor As it hath beene sundry times publickly acted by the right Honorable the Lord Chamberlaine his seruants. Written by Ben. Iohnson.,"Jonson, Ben, 1573?-1637.",By S Stafford for Walter Burre and are to be sould at his shoppe in Paules Church yarde,Imprinted at London,No Keywords,1601
A04636,The alchemist. VVritten by Ben. Ionson,"Jonson, Ben, 1573?-1637.",Printed by Thomas Snodham for Walter Burre and are to be sold by Iohn Stepneth at the west end of Paules,London,No Keywords,1612
A04655,"Loues triumph through Callipolis Performed in a masque at court 1630. By his Maiestie with the lords, and gentlemen assisting. The inuentors. Ben. Ionson. Inigo Iones.","Jonson, Ben, 1573?-1637.; Jones, Inigo, 1573-1652.",Printed by I ohn N orton for Thomas Walkley and are to be sold at his shop at the signe of the Eagle and Child in Brittains burse,London,Masques --  Early works to 1800.,1631
A07498,A game at chæss as it was acted nine dayes to gether at the Globe on the banks side.,"Middleton, Thomas, d. 1627.",S n,London,No Keywords,1625
A07494,"Ciuitatis amor. = The cities loue An entertainment by water, at Chelsey, and White-hall. At the ioyfull receiuing of that illustrious hope of Great Britaine, the high and mighty Charles, to bee created Prince of Wales, Duke of Cornewall, Earle of Chester, &c. Together with the ample order and solemnity of his Highnesse creation, as it was celebrated in his Maiesties palace of White-hall on Monday, the fourth of Nouember. 1616. As also the ceremonies of that ancient and honourable Order of the Knights of the Bath; and all the triumphs showne in honour of his royall creation.","Middleton, Thomas, d. 1627.",Printed by Nicholas Okes for Thomas Archer and are to be sold at his shop in Popes head Pallace,London,"Charles --  I, --  King of England, 1600-1649. -- Order of the Bath --  Early works to 1800.",1616
A02096,"Euphues his censure to Philautus wherein is presented a philosophicall combat betweene Hector and Achylles, discouering in foure discourses, interlaced with diuerse delightfull tragedies, the vertues necessary to be incident in euery gentleman: had in question at the siege of Troy betwixt sondry Grecian and Troian lords: especially debated to discouer the perfection of a souldier. ... Robertus Greene, in artibus magister.","Greene, Robert, 1558?-1592.",Printed by Iohn Wolfe for Edward White and are to bee sold at his shop at the litle north doore of Paules at the signe of the Gunne,London,No Keywords,1587
A07512,"The triumphs of health and prosperity A noble solemnity performed through the city, at the sole cost and charges of the Honorable Fraternity of Drapers, at the inauguration of their most worthy brother, the Right Honorable, Cuthbert Hacket, Lord Major of the famous city of London. By Tho. Middleton Gent.","Middleton, Thomas, d. 1627.",By Nicholas Okes dwelling in Foster lane,Imprinted at London,"Hacket, Cuthbert, --  Sir, d. 1631 --  Early works to 1800.",1626
A02073,"Alcida Greenes metamorphosis, vvherein is discouered, a pleasant transformation of bodies into sundrie shapes, shewing that as vertues beautifie the mind, so vanities giue greater staines, than the perfection of any quality can rase out: the discourse confirmed with diuerse merry and delightfull histories; full of graue principles to content age, and sawsed with pleasant parlees, and witty answeres, to satisfie youth: profitable for both, and not offensiue to any. By R.G.","Greene, Robert, 1558?-1592.",Printed by George Purslowe,London,No Keywords,1617
A02110,"Greenes mourning garment giuen him by repentance at the funerals of loue, which he presentes for a fauour to all young gentlemen that wish to weane themselues from wanton desires. R. Greene. Vtriusq[ue] academia in artibus magister. Sero sed serio.","Greene, Robert, 1558?-1592.",Printed by I W olfe for Thomas Newman,London,No Keywords,1590
A07500,The ghost of Lucrece. By T.M. Gent,"Middleton, Thomas, d. 1627.",Printed by Valentine Simmes,At London,No Keywords,1600
A03207,"The hierarchie of the blessed angells Their names, orders and offices the fall of Lucifer with his angells written by Tho: Heywood","Heywood, Thomas, d. 1641.; Cecil, Thomas, fl. 1630, engraver.",Printed by Adam Islip,London,Angels --  Poetry --  Early works to 1800. -- Demonology --  Poetry --  Early works to 1800. -- Witchcraft --  Poetry --  Early works to 1800. -- Magic --  Poetry --  Early works to 1800.,1635
A01877,The mad-merry prankes of Robbin Good-fellow To the tune of Dulcina.,"Jonson, Ben, 1573?-1637, attributed name.",printed for H G osson,London,"Ballads, English --  17th century.",1625
A02157,"Planetomachia: or the first parte of the generall opposition of the seuen planets wherein is astronomically described their essence, nature, and influence: diuersly discouering in their pleasaunt and tragicall histories, the inward affections of the mindes ... Conteyning also a briefe apologie of the sacred and misticall science of astronomie: by Robert Greene, Master of Arts and student in phisicke. 1585.","Greene, Robert, 1558?-1592.",By T Dawson and G Robinson for Thomas Cadman dwelling at the great north doore of S Paules at the signe of the Byble,Imprinted at London,Planets --  Religious aspects --  Early works to 1800.,1585
A07528,"A faire quarrell with new additions of Mr. Chaughs and Trimtrams roaring, and the Bauds song, neuer before printed : as it was acted before the King, by the Prince His Highnesse seruants / [brace] written by Thomas Midleton, and William Rowley, [brace] gent.","Rowley, William, 1585?-1642?; Middleton, Thomas, d. 1627.",For I T and are to be sold at Christ Church gate,Printed at London,No Keywords,1617
A07524,The roaring girle. Or Moll Cut-Purse As it hath lately beene acted on the Fortune-stage by the Prince his Players. Written by T. Middleton and T. Dekkar.,"Dekker, Thomas, ca. 1572-1632. aut; Middleton, Thomas, d. 1627.",By Nicholas Okes for Thomas Archer and are to be sold at his shop in Popes head pallace neere the Royall Exchange,Printed at London,"Cutpurse, Moll, 1584?-1659 --  Drama --  Early works to 1800. -- Brigands and robbers --  Drama --  Early works to 1800.",1611
A02138,"The myrrour of modestie wherein appeareth as in a perfect glasse howe the Lorde deliuereth the innocent from all imminent perils, and plagueth the bloudthirstie hypocrites with deserued punishments. Shewing that the graie heades of dooting adulterers shall not go with peace into the graue, neither shall the righteous be forsaken in the daie of trouble. By R.G. Maister of Artes.","Greene, Robert, 1558?-1592.",By Roger Warde dwelling at the signe of the Talbot neere vnto Holburne Conduit,Imprinted at London,No Keywords,1584
A03223,"The iron age contayning the rape of Hellen: the siege of Troy: the combate between Hector and Aiax: Hector and Troilus slayne by Achilles: Achilles slaine by Paris: Aiax and Vlisses contend for the armour of Achilles: the death of Aiax, &c. Written by Thomas Heyvvood.","Heywood, Thomas, d. 1641.",By Nicholas Okes,Printed at London,Trojan War --  Drama.,1632
A03240,"A pleasant comedy, called A mayden-head well lost As it hath beene publickly acted at the Cocke-pit in Drury-lane, with much applause: by her Maiesties Seruants. Written by Thomas Heyvvood.","Heywood, Thomas, d. 1641.",Printed by Nicholas Okes for Iohn Iackson and Francis Church and are to be sold at the Kings Armes in Cheape side,London,No Keywords,1634
A02092,"A disputation, betweene a hee conny-catcher, and a shee conny-catcher whether a theefe or a whoore, is most hurtfull in cousonage, to the common-wealth. Discouering the secret villanies of alluring strumpets. With the conuersion of an English courtizen, reformed this present yeare, 1592. R.G.","Greene, Robert, 1558?-1592.",By A I effes for T G ubbin and are to be solde at the west ende of Paules,Imprinted at London,Crime --  England --  Early works to 1800. -- Criminals --  England --  Early works to 1800. -- England --  Social life and customs --  Early works to 1800.,1592
A07064,"Antonios reuenge. The second part. As it hath beene sundry times acted, by the children of Paules. Written by I.M.","Marston, John, 1575?-1634.",Printed by R Bradock for Thomas Fisher and are to be soulde by Matthew Lownes in Saint Dunstans Church yarde,London,No Keywords,1602
A02080,"Ciceronis amor· = Tullies loue VVherein is discoursed the prime of Ciceroes youth, setting out in liuely portraitures how young gentlemen that ayme at honour should leuell the end of their affections, holding the loue of countrie and friends in more esteeme then those fading blossomes of beautie, that onely feede the curious suruey of the eye. A worke full of pleasure as following Ciceroes vaine, who was as conceipted in his youth as graue in his age, profitable as conteining precepts worthie so famous an orator. By Robert Greene in Artibus magister.","Greene, Robert, 1558?-1592.",Printed by Robert Robinson for Thomas Newman and Iohn Winington,At London,"Cicero, Marcus Tullius.",1589
A04632,The workes of Beniamin Ionson,"Hole, William, d. 1624, engraver.; Jonson, Ben, 1573?-1637.",Printed by W Stansby and are to be sould by Rich Meighen,London,No Keywords,1616
A07398,The meeting of gallants at an ordinarie: or The walkes in Powles,"Dekker, Thomas, ca. 1572-1632, attributed name.; Middleton, Thomas, d. 1627, attributed name.",Printed by T C reede and are to be solde by Mathew Lawe dwelling in Paules Church yard,London,Plague --  England --  London --  Early works to 1800.,1604
A04651,Ben: Ionson's execration against Vulcan· VVith divers epigrams by the same author to severall noble personages in this kingdome. Never published before.,"Jonson, Ben, 1573?-1637.; Vaughan, Robert, engraver.",Printed by J O kes for Iohn Benson and A Crooke and are to be sold at his shop at St Dunstans Church yard in Fleet streete,London,"Epigrams, English.",1640
A04643,"The characters of two royall masques The one of blacknesse, the other of beautie. personated by the most magnificent of queenes Anne Queene of great Britaine, &c. With her honorable ladyes, 1605. and 1608. at White-hall: and inuented by Ben: Ionson.","Jonson, Ben, 1573?-1637.",by G Eld for Thomas Thorp and are to be sold by L Lisle at the signe of the Tigers head in Paules Church yard,Imprinted at London,Masques --  Early works to 1800.,1608
A07078,The scourge of villanie Three bookes of satyres.,"Marston, John, 1575?-1634.",Printed by I ames R oberts and are to be sold by Iohn Buzbie in Paules Church yard at the signe of the Crane,At London,"Satire, English.",1598
A08755,"Looke vp and see vvonders A miraculous apparition in the ayre, lately seene in Barke-shire at Bawlkin Greene neere Hatford. April. 9th. 1628.","Dekker, Thomas, ca. 1572-1632.",By N Okes for Roger Michell,Imprinted at London,Storms --  England --  Berkshire --  Early works to 1800. -- Meteorites --  England --  Berkshire --  Early works to 1800. -- Berkshire --  England --  History.,1628
A06271,"London looke backe at that yeare of yeares 1625 and looke forvvard, vpon this yeare 1630 / written not to terrifie, but to comfort.","Dekker, Thomas, ca. 1572-1632.",Printed by A M and are to bee sold by Ed Blackmoore at the Angell in Paules Church yard,London,"Great Britain --  History --  Charles I, 1625-1649. -- London (England) --  History --  17th century.",1630
A07074,The malcontent. Augmented by Marston. With the additions played by the Kings Maiesties servants. Written by Ihon Webster. 1604,"Webster, John, 1580?-1625?; Marston, John, 1575?-1634.",Printed by V alentine S immes for William Aspley and are to be sold at his shop in Paules Church yard,At London,No Keywords,1604
